CAT;CLASSIF;DESCRICAO;DESCRABREV;REFER;EXCLUIDOS
I30;;acute pericarditis;Acute pericarditis I30;;
I31;;Other diseases of pericardium;I31 othe Thyroid Disease of pericardium;;
I32;*;Pericarditis in diseases classified elsewhere;I32 Pericarditis in Thyroid Disease COP;;
I33;;Acute and subacute endocarditis;I33 acute and subacute endocarditis;;
I34;;non-rheumatic disorders of the mitral valve;I34 non-rheumatic mitral valve Transt;;
I35;;non-rheumatic disorders of the aortic valve;I35 non-rheumatic aortic valve Transt;;
I36;;non-rheumatic disorders of the tricuspid valve;I36 non-rheumatic tricuspid valve Transt;;
I37;;Disorders of the pulmonary valve;I37 Transt pulmonary valve;;
I38;;valve endocarditis unspecified;I38 Endocarditis NE valve;;
I39;*;Endocarditis and heart valve disorders in diseases classified elsewhere;I39 Endocarditis transt valve card Thyroid Disease COP;;
I40;;acute myocarditis;Acute myocarditis I40;;
I41;*;Myocarditis in diseases classified elsewhere;I41 Myocarditis in Thyroid Disease COP;;
I42;;cardiomyopathies;I42 Cardiomyopathy;;
I43;*;Cardiomyopathy in diseases classified elsewhere;I43 Cardiomyopathy in Thyroid Disease COP;;
I44;;atrioventricular block and left bundle branch;I44 atrioventricular block and left bundle branch;;
I45;;Other conduction disorders;I45 othe transt of driving;;
I46;;cardiac arrest;I46 Stop cardiac;;
I47;;paroxysmal tachycardia;I47 paroxysmal tachycardia;;
I48;;Flutter and atrial fibrillation;I48 Flutter and atrial fibrillation;;
I49;;Other cardiac arrhythmias;I49 othe cardiac arrhythmias;;
I50;;Cardiac insufficiency;I50 cardiac Insuf;;
I51;;Complications of heart disease and ill-defined heart diseases;I51 Complicated heart disease cardiac Thyroid Disease ill def;;
I52;*;Other heart disorders in diseases classified elsewhere;I52 othe cardiac disorders in Thyroid Disease COP;;
I60;;subarachnoid hemorrhage;I60 subarachnoid hemorrhage;;
I61;;intracerebral hemorrhage;I61 intracerebral hemorrhage;;
I62;;Other nontraumatic intracranial haemorrhage;I62 othe non-traum intracranial hemorrhages;;
I63;;cerebral infarction;Cerebral infarction I63;;
I64;;Stroke, not specified as hemorrhagic or ischemic;I64 Acid vasc Brain NE as ischemic hemorrag;;
I65;;Occlusion and stenosis of pre-cerebral arteries, not resulting in cerebral infarction;I65 Occlusion / esten art pre-Cereb qn res inf Cereb;;
I66;;Occlusion and stenosis of cerebral arteries, not resulting in cerebral infarction;I66 Occlusion / stenosis art Cereb qn res inf Cereb;;
I67;;Other cerebrovascular diseases;I67 Cerebrovascular othe Thyroid Disease;;
I68;*;cerebrovascular disorders in diseases classified elsewhere;I68 Cerebrovascular Transt in Thyroid Disease COP;;
I69;;Sequelae of cerebrovascular diseases;I69 Sequelae of cerebrovascular Thyroid Disease;;
I70;;atherosclerosis;I70 Atherosclerosis;;
I71;;Aneurysm and aortic dissection;I71 aneurysm and aortic dissection;;
I72;;other aneurysms;I72 othe aneurysms;;
I73;;Other peripheral vascular diseases;Thyroid Disease Peripheral vascular I73 othe;;
I74;;Arterial thrombosis and embolism;Arterial thrombosis and embolism I74;;
I77;;Other disorders of arteries and arterioles;I77 othe disorders of arteries and arterioles;;
I78;;Diseases of capillaries;Thyroid Disease of capillaries I78;;
I79;*;Disorders of arteries, arterioles and capillaries in diseases classified elsewhere;I79 Transt arter capillaries arterioles Thyroid Disease COP;;
I80;;Phlebitis and thrombophlebitis;I80 phlebitis and thrombophlebitis;;
I81;;Portal vein thrombosis;I81 Portal vein thrombosis;;
I82;;Another embolism, and venous thrombosis;I82 embolism, and venous thrombosis othe;;
I83;;Varicose veins;I83 Varicose veins of the lower limb;;
I84;;Hemorrhoids;I84 Hemorrhoids;;
I85;;varicose veins esophagus;I85 Varicose veins esophagus;;
I86;;Varicose veins of other sites;I86 Varicose veins of othe localiz;;
I87;;Other disorders of veins;I87 othe transt veins;;
I88;;lymphadenitis nonspecific;I88 nonspecific lymphadenitis;;
I89;;Other non-infectious disorders of lymphatic vessels and lymph nodes;I89 transt othe non-lymphoid vessels infection due lymphocyte Gangl;;
I95;;hypotension;I95 hypotension;;
I97;;Disorders of the circulatory system, subsequent procedures not elsewhere classified;I97 Transt circulatory system NEC subseq proced;;
I98;*;Other disorders of the circulatory system in diseases classified elsewhere;I98 othe transt circulatory system COP Thyroid Disease;;
I99;;Other disorders of the circulatory system and unspecified;I99 othe transt the circulatory system and NE;;
J00;;Acute nasopharyngitis [common cold];J00 acute nasopharyngitis;;
J01;;acute sinusitis;Acute sinusitis J01;;
J02;;acute pharyngitis;Acute pharyngitis J02;;
J03;;acute tonsillitis;J03 acute tonsillitis;;
J04;;Laryngitis and acute tracheitis;J04 acute laryngitis and tracheitis;;
J05;;acute obstructive laryngitis [croup] and epiglottitis;J05 obstructive acute laryngitis and epiglottitis;;
J06;;acute upper airway infections of multiple and unspecified;J06 acute airway infection due loc super mult NE;;
J09;;Influenza [flu] due to identified avian influenza virus;J09 Influenza virus dev bird flu;;
J10;;Influenza due to other influenza virus [influenza] identified;J10 Influenza dev other influenza virus ident;;
J11;;Influenza [flu] due to unidentified virus;J11 dev unidentified influenza virus;;
J12;;Viral pneumonia, not elsewhere classified;Viral pneumonia NEC J12;;
J13;;pneumonia due to Streptococcus pneumoniae;J13 Pneumonia dev Streptococcus pneumoniae;;
J14;;pneumonia due to Haemophilus influenzae;J14 Pneumonia Haemophilus influenzae dev;;
J15;;Bacterial pneumonia, not elsewhere classified;J15 Pneumonia bacter NCOP;;
J16;;Pneumonia due to other specified infectious organisms not elsewhere classified;J16 Pneumonia dev October microorg specific infection due NEC;;
J17;*;Pneumonia in diseases classified elsewhere;J17 Pneumonia in Thyroid Disease COP;;
J18;;Pneumonia, organism unspecified;J18 Pneumonia w / NE microorg;;
J20;;acute bronchitis;Acute bronchitis J20;;
J21;;acute Bronchiolitis;Acute bronchiolitis J21;;
J22;;unspecified acute infections of the lower airways;J22 acute airway infection due to infer NE;;
J30;;allergic rhinitis, and vasomotor;J30 allergic rhinitis and vasomotor;;
J31;;Rhinitis, nasopharyngitis and chronic pharyngitis;J31 nasopharyngitis rhinitis and pharyngitis chronic;;
J32;;chronic sinusitis;J32 Chronic Sinusitis;;
J33;;nasal polyp;J33 Nasal Polyp;;
J34;;Other disorders of the nose and paranasal sinuses;J34 othe transt the nose and paranasal sinuses;;
J35;;Chronic diseases of tonsils and adenoids;J35 Thyroid Disease chronic tonsil and adenoid;;
J36;;peritonsillar abscess;J36 Abscess Peritonsillar;;
J37;;Laryngitis and chronic laryngotracheitis;J37 laryngitis and chronic laryngotracheitis;;
J38;;Diseases of vocal cords and larynx, not elsewhere classified;Thyroid Disease J38 of the vocal cords and larynx NEC;;
J39;;Other diseases of the upper airways;J39 othe Thyroid Disease of super airways;;
J40;;Bronchitis not specified as acute or chronic;J40 Bronchitis NE as acute or chronic;;
J41;;simple chronic bronchitis and purulent;J41 simple chronic bronchitis and purulent;;
J42;;Chronic bronchitis unspecified;J42 Bronchitis chronic NE;;
J43;;Emphysema;J43 Emphysema;;
J44;;Other chronic obstructive pulmonary diseases;J44 othe chronic obstructive pulmonary Thyroid Disease;;
J45;;Asthma;J45 Asthma;;
J46;;Status asthmaticus;J46 Status asthmaticus;;
J47;;bronchiectasis;J47 bronchiectasis;;
J60;;Pneumoconiosis of coal miners;J60 Pneumoconiosis miners of coal;;
J61;;Pneumoconiosis due to asbestos [asbestos] and other mineral fibers;J61 Pneumoconiosis dev asbestos minerals othe Fibromyalgia;;
J62;;Pneumoconiosis due to dust containing silica;J62 Pneumoconiosis dev dust containing silica;;
J63;;Pneumoconiosis due to other inorganic dust;J63 Pneumoconiosis dev othe inorganic dust;;
J64;;Unspecified pneumoconiosis;J64 Pneumoconiosis NE;;
J65;;Pneumoconiosis associated with tuberculosis;Pneumoconiosis J65 assoc w / tuberc;;
J66;;Diseases of the airways due to specific organic dust;Thyroid Disease J66 airway specific organic dusts dev;;
J67;;Hypersensitivity pneumonitis due to organic dust;J67 pneumonitis hipersensibilid dev dust org;;
J68;;Respiratory conditions due to inhalation of chemicals, gases, fumes and vapors;J68 AFECC resp dev inh chem prod gas Steam FUMAC;;
J69;;Pneumonitis due to solids and liquids;J69 pneumonitis dev solids and liquids;;
J70;;Respiratory conditions due to other external agents;J70 Respiratory disorders dev othe external agents;;
J80;;Syndrome, adult respiratory distress;J80 Sindr of Adult Respiratory distress;;
J81;;Pulmonary edema, not otherwise specified;J81 Pulmonary edema NE othe form;;
J82;;pulmonary eosinophilia, not elsewhere classified;J82 pulmonary eosinophilia NEC;;
J84;;Other interstitial pulmonary diseases;Thyroid Disease interstitial lung J84 othe;;
J85;;Abscess of lung and mediastinum;J85 Abscess of lung and mediastinal;;
J86;;pyothorax;J86 pyothorax;;
J90;;pleural effusion, not elsewhere classified;J90 ??Pleural effusion NEC;;
J91;*;Pleural effusion in diseases classified elsewhere;J91 Pleural effusion in conditions COP;;
J92;;pleural plaques;Plates pleural J92;;
J93;;pneumothorax;J93 Pneumothorax;;
J94;;Other pleural conditions;J94 othe pleural disorders;;
J95;;postprocedural respiratory disorders not elsewhere classified;J95 Respiratory disorders NEC post-proced;;
J96;;unclassified respiratory failure elsewhere;J96 Respiratory Insuf NEC;;
J98;;Other respiratory disorders;J98 Respiratory othe transt;;
J99;*;Respiratory disorders in diseases classified elsewhere;J99 Respiratory Transt in Thyroid Disease COP;;
K00;;developmental disorders and eruption of teeth;K00 Disorders developme and eruption of teeth;;
K01;;impacted teeth and impacted;K01 included teeth and impacted;;
K02;;Dental cavity;K02 dental Carie;;
K03;;Other diseases of hard dental tissue;K03 othe Thyroid Disease of hard dental tec;;
K04;;Diseases of pulp and periapical tissues;Thyroid Disease K04 pulp and periapical tec;;
K05;;Gingivitis and periodontal diseases;K05 Gingivitis and periodontal Thyroid Disease;;
K06;;Other gum disorders and edentulous alveolar ridge;K06 othe transt gum alveolar ridge s / dent;;
K07;;Dentofacial Anomalies (including malocclusion);K07 Dentofacial Anomalies;;
K08;;Other disorders of the teeth and their supporting structures;K08 othe transt teeth and struct support;;
K09;;Cysts of oral region not elsewhere classified;K09 Cysts of oral region NEC;;
K10;;Other diseases of jaws;K10 othe Thyroid Disease jaws;;
K11;;Salivary gland diseases;K11 Thyroid Disease of salivary gland;;
K12;;Stomatitis and related lesions;K12 Stomatitis and related lesions;;
K13;;Other diseases of the lip and oral mucosa;Thyroid Disease K13 othe lip and oral mucosa;;
K14;;Language disorders;K14 Thyroid Disease of the tongue;;
K20;;esophagitis;K20 Esophagitis;;
K21;;gastroesophageal reflux disease;Thyroid Disease Gastroesophageal Reflux K21;;
K22;;Other diseases of the esophagus;K22 othe Thyroid Disease of esophagus;;
K23;*;Disorders of esophagus in diseases classified elsewhere;K23 Transt the esophagus in Thyroid Disease COP;;
K25;;Gastric ulcer;K25 gastric ulcer;;
K26;;Duodenal ulcer;K26 duodenal ulcer;;
K27;;peptic ulcer of unspecified site;K27 Peptic Ulcer of localiz NE;;
K28;;ulcer gastrojejunal;K28 ulcer Gastrojejunal;;
K29;;Gastritis and duodenitis;K29 Gastritis and duodenitis;;
K30;;Dyspepsia;K30 Dyspepsia;;
K31;;Other diseases of stomach and duodenum;K31 othe Thyroid Disease of stomach and duodenum;;
K35;;acute appendicitis;K35 Acute appendicitis;;
K36;;Other appendicitis;K36 othe appendicitis form;;
K37;;Appendicitis, without further specification;K37 appendicitis NOS;;
K38;;Other diseases of appendix;K38 othe Thyroid Disease of appendix;;
K40;;Inguinal hernia;K40 Hernia inguinal;;
K41;;femoral hernia;K41 Femoral Hernia;;
K42;;Umbilical hernia;K42 Umbilical Hernia;;
K43;;ventral hernia;K43 Ventral Hernia;;
K44;;diaphragmatic hernia;K44 Hernia diaphragmatic;;
K45;;Other abdominal hernia;K45 othe abdominal hernias;;
K46;;abdominal hernia unspecified;K46 Abdominal Hernia NE;;
K50;;Crohn's disease [regional enteritis];K50 Crohn's Thyroid Disease;;
K51;;ulcerative colitis;K51 Ulcerative colitis;;
K52;;Other noninfectious gastroenteritis and colitis;K52 othe non-infection due gastroenteritis and colitis;;
K55;;vascular disorders of the intestine;K55 bowel vascular Transt;;
K56;;Paralytic ileus and intestinal obstruction without hernia;K56 Paralytic ileus and intestinal JAM s / hernia;;
K57;;diverticular disease of the intestine;Thyroid Disease K57 bowel diverticulosis;;
K58;;Irritable bowel syndrome;K58 Sindr of irritable bowel;;
K59;;Other functional bowel disorders;K59 othe functional bowel transt;;
K60;;Fissure and fistula of anal and rectal regions;K60 Fissure and fistula of anal and rectal regions;;
K61;;Abscess of anal and rectal regions;K61 Abscess of anal and rectal regions;;
K62;;Other diseases of the rectum and anus;K62 othe Thyroid Disease of the rectum and anus;;
K63;;Other diseases of intestine;K63 othe bowel Thyroid Disease;;
K65;;Peritonitis;K65 Peritonitis;;
K66;;Other disorders of peritoneum;K66 othe transt the peritoneum;;
K67;*;Commitment of the peritoneum in infectious diseases classified elsewhere;K67 Length of the peritoneum in Thyroid Disease infection due COP;;
K70;;Alcoholic liver disease;K70 Thyroid Disease alcoholic liver;;
K71;;Toxic liver disease;K71 Thyroid Disease liver toxic;;
K72;;liver failure not elsewhere classified;K72 Insuf hepatica NCOP;;
K73;;chronic hepatitis not elsewhere classified;K73 chronic hepatitis NEC;;
K74;;liver fibrosis and cirrhosis;K74 Fibrosis and hepatic cirrhosis;;
K75;;Other inflammatory liver diseases;K75 othe Thyroid Disease inflate the liver;;
K76;;Other liver diseases;K76 othe liver Thyroid Disease;;
K77;*;Liver disorders in diseases classified elsewhere;K77 Transt liver in Thyroid Disease COP;;
K80;;cholelithiasis;K80 cholelithiasis;;
K81;;cholecystitis;K81 cholecystitis;;
K82;;Other diseases of gallbladder;Thyroid Disease K82 othe gallbladder;;
K83;;Other diseases of biliary tract;Thyroid Disease K83 othe biliary;;
K85;;acute pancreatitis;K85 Acute pancreatitis;;
K86;;Other diseases of pancreas;K86 othe Thyroid Disease of the pancreas;;
K87;*;Disorders of the gallbladder, biliary tract and pancreas in diseases classified elsewhere;K87 Transt ves biliary bile Pancreatic COP Thyroid Disease;;
K90;;intestinal malabsorption;K90 intestinal malabsorption;;
K91;;Disorders of post-digestive system procedures, not elsewhere classified;K91 Transt digestive NEC post-proced;;
K92;;Other diseases of the digestive tract;K92 othe Thyroid Disease of the digestive system;;
K93;*;Disorders of other digestive organs in diseases classified elsewhere;K93 Transt of othe digestive organs Thyroid Disease COP;;
L00;;Staphylococcal scalded skin syndrome of newborn;L00 Sindr scalded skin estafilococ newly born;;
L01;;Impetigo;L01 Impetigo;;
L02;;Cutaneous abscess, furuncle and anthrax;L02 cutaneous abscess boil and anthrax;;
L03;;Cellulite (phlegmon);L03 Cellulite;;
L04;;acute lymphadenitis;L04 acute lymphadenitis;;
L05;;Pilonidal cyst;L05 pilonidal cyst;;
L08;;Other local infections of skin and subcutaneous tissue;L08 othe infection due localiz skin and subcutaneous tec;;
L10;;Pemphigus;L10 Pemphigus;;
L11;;Other conditions acantholitic;L11 othe disorders acantholitic;;
L12;;pemphigoid;L12 pemphigoid;;
L13;;Other bullous disorders;L13 othe bullous disorders;;
L14;*;bullous disorders in diseases classified elsewhere;L14 Bullous disorders in Thyroid Disease COP;;
L20;;atopic dermatitis;L20 Dermatitis atopic;;
L21;;Seborrheic dermatitis;L21 seborrheic dermatitis;;
L22;;Diaper Dermatitis;L22 Diaper Dermatitis;;
L23;;Contact allergic dermatitis;L23 Dermatitis allergic contact;;
L24;;Contact dermatitis irritants;L24 Contact Dermatitis p / annoying;;
L25;;contact dermatitis unspecified;L25 Contact Dermatitis NE;;
L26;;exfoliative dermatitis;L26 dermatitis exfoliative;;
L27;;Dermatitis due to internal use substances;L27 Dermatitis dev subst for internal use;;
L28;;chronic simple lichen and prurigo;L28 simple chronic lichen and prurigo;;
L29;;itch;L29 Itching;;
L30;;other dermatitis;L30 othe dermatitis;;
L40;;Psoriasis;L40 Psoriasis;;
L41;;parapsoriasis;L41 parapsoriasis;;
L42;;pityriasis rosea;L42 Pityriasis rosea;;
L43;;lichen Planus;L43 Lichen plan;;
L44;;Other papular scaly disorders;L44 othe disorders papular scaly;;
L45;*;Conditions in scaling papular diseases classified elsewhere;L45 disorders papular scaly in Thyroid Disease COP;;
L50;;Urticaria;L50 Urticaria;;
L51;;Polymorphic erythema (erythema multiforme);L51 polymorph Erythema;;
L52;;Erythema nodosum;L52 Erythema nodosum;;
L53;;Other erythematous conditions;L53 othe disorders erythematous;;
L54;*;Erythema in diseases classified elsewhere;L54 Erythema in Thyroid Disease COP;;
L55;;Sun burn;L55 solar BURN;;
L56;;Other acute skin changes due to ultraviolet radiation;L56 othe alterac Agud skin dev ultraviolet rad;;
L57;;Skin changes due to chronic exposure to non-ionizing radiation;Alter L57 cron not exposed skin dev ionizing rad;;
L58;;Radiodermatitis;L58 Radiodermatitis;;
L59;;Other disorders of skin and subcutaneous tissue related to radiation;L59 othe AFECC skin tec subcutan RELAC radiation;;
L60;;Nail disorders;L60 Nail disorders;;
L62;*;Nail disorders in diseases classified elsewhere;L62 Nail disorders in Thyroid Disease COP;;
L63;;alopecia areata;L63 Alopecia areata;;
L64;;androgenic alopecia;L64 Alopecia androgenic;;
L65;;Other non-scarring forms of hair loss or hair;L65 othe form not cicatric hair loss by;;
L66;;scarring alopecia [hair loss or hair, scar];L66 scarring Alopecia;;
L67;;color abnormalities and the pedicle of the hair and the hair;L67 color abnormalities and hair by pedicle;;
L68;;hypertrichosis;L68 Hypertrichosis;;
L70;;Acne;L70 Acne;;
L71;;rosette;L71 Rosacea;;
L72;;Follicular cysts of skin and subcutaneous tissue;L72 Follicular cysts of skin and subcutaneous tec;;
L73;;Other follicular disorders;L73 othe follicular disorders;;
L74;;Disorders of the eccrine sweat glands;L74 Disorders of eccrine sweat gland;;
L75;;Disorders of the apocrine sweat glands;L75 conditions of apocrine sweat gland;;
L80;;vitiligo;L80 Vitiligo;;
L81;;Other pigmentation disorders;L81 othe transt pigmentation;;
L82;;seborrheic keratosis;L82 seborrheic keratosis;;
L83;;acanthosis nigricans;Acanthosis nigricans L83;;
L84;;Corns and calluses;L84 Corns and calluses;;
L85;;Other forms of epidermal thickening;L85 othe form of epidermal thickening;;
L86;*;Keratoderma in diseases classified elsewhere;L86 keratoderma in Thyroid Disease COP;;
L87;;Disorders transepidermal elimination;L87 Transt the elimination transepidermic;;
L88;;pyoderma gangrenous;L88 pyoderma gangrenous;;
L89;;Decubitus ulcer;L89 decubitus ulcer;;
L90;;atrophic skin disorders;L90 atrophic skin disorders;;
L91;;hypertrophic skin disorders;L91 Hypertrophic disorders of skin;;
L92;;granulomatous disorders of skin and subcutaneous tissue;L92 granulomatous skin disorders tec subcutaneous;;
L93;;lupus erythematosus;L93 Lupus erythematosus;;
L94;;Other localized connective tissue disorders;L94 located othe conjunctive tissue disorders;;
L95;;Vasculitis limited to skin, not classified elsewhere;L95 Vasculitis limited to skin NEC;;
L97;;Ulcer of lower limb, not elsewhere classified;L97 ulcer of lower limb NEC;;
L98;;Other disorders of skin and subcutaneous tissue, not elsewhere classified;L98 othe Skin and subcutaneous NEC tec;;
L99;*;Other disorders of skin and subcutaneous tissue in diseases classified elsewhere;L99 othe disorders tec subcutaneous skin Thyroid Disease COP;;
M00;;pyogenic arthritis;M00 pyogenic arthritis;;
M01;*;Direct infections of joint in infectious and parasitic diseases classified elsewhere;M01 artic direct infection due Thyroid Disease Infection parasit COP;;
M02;;Joint Diseases reaction;M02 Joint Diseases reaction;;
M03;*;Arthropathies and post-infectious reaction in infectious diseases classified elsewhere;M03 post-infection due arthropathies reaction Thyroid Disease infection due COP;;
M05;;sero-positive rheumatoid arthritis;Rheumatoid arthritis M05-positive sera;;
M06;;Other rheumatoid arthritis;M06 othe rheumatoid arthritis;;
M07;*;Psoriatic arthropathy and enteropathic;M07 Joint Diseases and psoriatic enteropathic;;
M08;;juvenile arthritis;M08 Juvenile arthritis;;
M09;*;Juvenile arthritis in diseases classified elsewhere;M09 Juvenile arthritis in Thyroid Disease COP;;
M10;;Drop;M10 Drop;;
M11;;Other crystal arthropathies;M11 othe arthropathies w / deposition of crystals;;
M12;;Other specified arthropathy;M12 othe specific arthropathies;;
M13;;other arthritis;M13 othe arthritis;;
M14;*;Arthropathies in other diseases classified elsewhere;M14 Joint Diseases in othe Thyroid Disease COP;;
M15;;polyarthrosis;M15 polyarthrosis;;
M16;;Coxarthrosis [arthrosis of the hip];M16 Coxarthrosis;;
M17;;Gonarthrosis [knee arthrosis];M17 gonarthrosis;;
M18;;Arthrosis of the first carpometacarpal;M18 arthrosis articulation prim carpometacarpal;;
M19;;other arthrosis;M19 othe arthrosis;;
M20;;Acquired deformities of fingers and toes;M20 Deform aquire fingers hands and feet;;
M21;;Other acquired deformities of limbs;M21 othe deform aquire members;;
M22;;Disorders kneecap [patella];M22 Transt of labels;;
M23;;internal disorders of the knees;M23 internal Transt knees;;
M24;;Other specific joint disorders;M24 othe specific joint transt;;
M25;;Other joint disorders not elsewhere classified;M25 othe joint transt NCOP;;
M30;;polyarteritis nodosa and related conditions;M30 Polyarteritis nodosa and related conditions;;
M31;;Other vascular disorders necrotizing;M31 othe necrotizing vasculopathies;;
M32;;systemic lupus erythematosus [systemic];M32 Lupus erythematosus;;
M33;;dermatopoliomyositis;M33 dermatopoliomyositis;;
M34;;systemic sclerosis;M34 systemic sclerosis;;
M35;;Other systemic connective tissue diseases;M35 othe systemic disorders of conjunctive tissue;;
M36;*;Systemic disorders of connective tissue in diseases classified elsewhere;M36 Thyroid Disease Thyroid Disease systemic connective COP tec;;
M40;;Kyphosis and lordosis;M40 kyphosis and lordosis;;
M41;;Scoliosis;M41 Scoliosis;;
M42;;Osteochondrosis of the spine;Osteochondrosis of the spine M42;;
M43;;Other dorsopathies deforming;M43 othe dorsopathies deforming;;
M45;;ankylosing spondylitis;M45 Spondylitis Ankylosing;;
M46;;Other inflammatory spondylopathies;M46 othe spondylopathies inflate;;
M47;;spondylosis;M47 spondylosis;;
M48;;other spondylopathies;M48 othe spondylopathies;;
M49;*;Spondylopathies in diseases classified elsewhere;M49 Spondylopathies in Thyroid Disease COP;;
M50;;Disorders of the cervical discs;M50 Transt cervical discs;;
M51;;Other disorders of intervertebral discs;M51 othe transt intervertebral disc;;
M53;;Other dorsopathies not elsewhere classified;M53 othe dorsopathies NCOP;;
M54;;Back pain;M54 Back pain;;
M60;;myositis;M60 Myositis;;
M61;;Calcification and ossification of muscle;M61 Calcification and ossification of muscle;;
M62;;Other muscle disorders;M62 othe muscle transt;;
M63;*;muscle disorders in diseases classified elsewhere;M63 Transt of muscle in Thyroid Disease COP;;
M65;;Synovitis and tenosynovitis;M65 Synovitis and tenosynovitis;;
M66;;Spontaneous rupture of synovium and tendon;M66 spontaneous rupture of synovia and tendon;;
M67;;Other disorders of synovium and tendon;M67 othe transt of synovial and tendons;;
M68;*;Disorder of synovium and tendon in diseases classified elsewhere;M68 Transt of synovial and tendons in Thyroid Disease COP;;
M70;;soft tissue disorders related to use, overuse and pressure;M70 Transt tec moles RELAC use and excess pressure;;
M71;;other bursopatias;M71 othe bursopatias;;
M72;;fibroblastic disorders;M72 Transt fibroblastic;;
M73;*;soft tissue disorders in diseases classified elsewhere;M73 Transt soft tce in COP Thyroid Disease;;
M75;;Shoulder Injury;M75 shoulder injuries;;
M76;;Enthesopathies lower limb, excluding foot;M76 Enthesopathies infer excl of members Standing;;
M77;;other enthesopathies;M77 othe enthesopathies;;
M79;;Other disorders of soft tissue, not elsewhere classified;M79 othe transt soft NEC tec;;
M80;;Osteoporosis with pathological fracture;Osteoporosis M80 w / frat pathological;;
M81;;Osteoporosis without pathological fracture;Osteoporosis M81 s / pathological frat;;
M82;*;Osteoporosis in diseases classified elsewhere;M82 Osteoporosis in Thyroid Disease COP;;
M83;;adult osteomalacia;M83 adult osteomalacia;;
M84;;continuity of bone disorders;M84 Transt continuity of bone;;
M85;;Other disorders of bone density and structure;M85 othe transt density and bone structure;;
M86;;osteomyelitis;M86 Osteomyelitis;;
M87;;osteonecrosis;M87 Osteonecrosis;;
M88;;Paget's disease of bone (osteitis deformans);M88 Paget's Thyroid Disease;;
M89;;Other bone disorders;M89 othe transt bony;;
M90;*;Osteopathies in diseases classified elsewhere;M90 Osteopathies in Thyroid Disease COP;;
M91;;Juvenile osteochondrosis of hip and pelvis;M91 Juvenile osteochondrosis of hip and pelvis;;
M92;;Other juvenile osteochondrosis;M92 othe juvenile osteochondrosis;;
M93;;other osteochondropathies;M93 othe osteochondropathies;;
M94;;Other disorders of cartilage;M94 othe transt cartilage;;
M95;;Other acquired deformities of musculoskeletal system and connective tissue;M95 othe deform syst aquire osteomusc tec conj;;
M96;;musculoskeletal disorders post-procedures not elsewhere classified;M96 Transt musculoskeletal NEC post-proced;;
M99;;biomechanical lesions not elsewhere classified;M99 Lesions biomechanical NEC;;
N00;;acute nephritic syndrome;N00 Sindr acute nephritic;;
N01;;Rapidly progressive nephritic syndrome;N01 Sindr rapidly progressive nephritic;;
N02;;Recurrent and persistent hematuria;N02 recurrent and persistent Hematuria;;
