CAT;CLASSIF;DESCRICAO;DESCRABREV;REFER;EXCLUIDOS
Q84;;Other congenital malformations of integument;Q84 othe congen malformations of integument;;
Q85;;Phakomatoses not elsewhere classified;Q85 Phakomatoses NCOP;;
Q86;;Congenital malformation syndromes due to known exogenous causes, not elsewhere classified;Q86 Sindr c / dev malf cong causes exog Cognac NEC;;
Q87;;Other congenital malformation syndromes affecting multiple systems;Q87 othe sindr c / q malform cong acomet Multi sist;;
Q89;;Other congenital malformations not elsewhere classified;Q89 othe malformations congen NCOP;;
Q90;;Down's syndrome;Q90 Sindr Down;;
Q91;;Edwards syndrome and Patau syndrome;Q91 Sindr Edwards and Patau sindr;;
Q92;;Other trisomies and partial trisomies of autosomes, not elsewhere classified;Q92 othe trisomies and trissom parc autoss NCOP;;
Q93;;Monosomy and deletions from the autosomes, not elsewhere classified;Q93 monosomy and deletions from the autosomes NEC;;
Q95;;Balanced rearrangements and structural markers, not elsewhere classified;Q95 rearrangements equilibr and struct markers NEC;;
Q96;;Turner syndrome;Q96 Sindr Turner;;
Q97;;Other anomalies of the sex chromosomes, female phenotype, not elsewhere classified;Q97 othe Anom sex chromosomal phenotype fem NCOP;;
Q98;;Other anomalies of the sex chromosomes, male phenotype, not elsewhere classified;Q98 othe Anom phenotype sex chromosomal Male NEC;;
Q99;;Other chromosome abnormalities, not elsewhere classified;Q99 othe abnormalities of chromosomes NEC;;
R00;;Heart rhythm abnormalities;R00 Abnormalities of heartbeat;;
R01;;Murmurs and other heart sounds;R01 Puffs and othe noises cardiac;;
R02;;Gangrene, not elsewhere classified;R02 Gangrene NCOP;;
R03;;Abnormal blood pressure undiagnosed;R03 abnormal blood pressure value s / Diag;;
R04;;Airway hemorrhage;Respiratory tract bleeding of R04;;
R05;;Cough;R05 Cough;;
R06;;Abnormalities of breathing;R06 Abnormalities of breathing;;
R07;;Sore throat and chest;R07 Sore throat and chest;;
R09;;Other symptoms and signs involving the circulatory and respiratory systems;R09 synthetic othe signals after circulatory Respiratory vs;;
R10;;abdominal and pelvic pain;R10 Abdominal and pelvic pain;;
R11;;Nausea and vomiting;R11 Nausea and vomiting;;
R12;;heartburn;R12 Heartburn;;
R13;;Dysphagia;R13 Dysphagia;;
R14;;Flatulence and related conditions;R14 flatulence and related conditions;;
R15;;fecal incontinence;R15 Fecal incontinence;;
R16;;Hepatomegaly and splenomegaly not elsewhere classified;R16 Hepatomegaly and splenomegaly NCOP;;
R17;;Jaundice unspecified;R17 bile duct NE;;
R18;;ascites;R18 Ascites;;
R19;;Other symptoms and signs involving the digestive system and abdomen;R19 and synthetic othe signals after digestion abdomen vs;;
R20;;Disturbances of skin sensation;R20 Disturbances of cutaneous sensitivity;;
R21;;Rash and other nonspecific skin eruption;R21 Erythema and othe cutaneous eruptions NE;;
R22;;Swelling, mass and lump localized skin and subcutaneous tissue;R22 Tumefac tumor mass loc skin tec subcut;;
R23;;Other skin changes;R23 othe cutaneous alterations;;
R25;;Abnormal involuntary movements;R25 abnormal involuntary movements;;
R26;;Abnormalities of gait and mobility;R26 abnormalities of gait and mobility;;
R27;;Other coordination disturbances;R27 othe disorders of coordination;;
R29;;Other symptoms and signs involving the nervous and musculoskeletal systems;R29 othe sint signs relat syst nerv osteomusc;;
R30;;Pain associated with voiding;R30 Pain assoc urination;;
R31;;Unspecified haematuria;R31 Hematuria NE;;
R32;;Urinary incontinence unspecified;R32 urinary incontinence NE;;
R33;;Urinary retention;R33 urinary retention;;
R34;;Anuria and oliguria;R34 Anuria and oliguria;;
R35;;polyuria;R35 polyuria;;
R36;;urethral discharge;R36 urethral secretion;;
R39;;Other symptoms and signs involving the urinary system;R39 othe sint and signs involving the urinary ap;;
R40;;Somnolence, stupor and coma;R40 drowsy stupor and coma;;
R41;;Other symptoms and signs involving cognitive functions and awareness;R41 othe sint signs relat func Cognit and consc;;
R42;;Dizziness and instability;R42 Dizziness and instability;;
R43;;smell and taste disorders;R43 Disturbances of smell and taste;;
R44;;Other symptoms and signs involving the sensations and general perceptions;R44 othe sint signs relat sensac general perception;;
R45;;Symptoms and signs involving emotional state;Sint R45 and signs involving emotional state;;
R46;;Symptoms and signs involving appearance and behavior;Sint R46 and signs involving appearance and comport;;
R47;;Speech disorders not elsewhere classified;R47 Disturbances of speech NEC;;
R48;;Dyslexia and other symbolic dysfunctions, not elsewhere classified;R48 Dyslexia and othe dysfunctions symbolic NEC;;
R49;;Voice disorders;R49 Voice Disorders;;
R50;;Fever of unknown origin, and other sources;R50 fever of unknown origin, and other sources;;
R51;;headaches;R51 Headache;;
R52;;Pain not elsewhere classified;R52 Pain NEC;;
R53;;Malaise, fatigue;R53 Malaise fatigue;;
R54;;Senility;R54 Senility;;
R55;;Syncope and collapse;R55 Syncope and collapse;;
R56;;Convulsions, not elsewhere classified;R56 seizures NEC;;
R57;;Shock, not elsewhere classified;R57 Shock NEC;;
R58;;Bleeding not elsewhere classified;R58 haemorrhage NEC;;
R59;;swelling of lymph nodes;R59 Increased volume of lymph glands;;
R60;;Edema, not elsewhere classified;R60 Edema NEC;;
R61;;hyperhidrosis;R61 Hyperhidrosis;;
R62;;Delay normal physiological development;R62 Delay normal physiological developme;;
R63;;Symptoms and signs concerning food and fluid intake;R63 Sint signs relat liquid food intake;;
R64;;cachexy;R64 Cachexia;;
R68;;Other general symptoms and signs;R68 othe sint and general signs;;
R69;;Unknown and unspecified causes of morbidity;R69 unknown causes of morbidity and NE;;
R70;;Elevated erythrocyte sedimentation speed and other abnormalities of plasma viscosity;R70 Speed ??hemossedim elev othe abnorm visc plasm;;
R71;;Abnormality of red blood cells;R71 Abnormality of erythrocytes;;
R72;;Abnormal leukocytes not elsewhere classified;R72 Abnormality of leukocytes NEC;;
R73;;Increased blood glucose;R73 Increased blood glucose;;
R74;;Abnormalities of serum levels of enzymes;R74 Abnormalities of serum levels of enzymes;;
R75;;Laboratory evidence of human immunodeficiency virus [HIV];R75 laboratory HIV evidences;;
R76;;Other abnormal immunological findings in serum;R76 othe abnormal immunological findings in serum;;
R77;;Other abnormalities of plasma proteins;R77 othe abnormalities of plasma proteins;;
R78;;Presence of drugs and other substances, not normally found in blood;R78 Presence drog othe subst norm n Found sang;;
R79;;Other abnormal findings of blood chemistry tests;R79 othe abnormal findings chemical tests blood;;
R80;;proteinuria isolated;R80 isolated Proteinuria;;
R81;;glycosuria;R81 glycosuria;;
R82;;Other abnormal findings in urine;R82 othe abnormal findings in urine;;
R83;;Abnormal findings in cerebrospinal fluid;R83 Abnormal findings cerebrospinal fluid;;
R84;;Abnormal findings in specimens from respiratory organs and chest;R84 Abnormal findings mat prov ed Respiratory chest;;
R85;;Abnormal findings in specimens from digestive organs and abdominal cavity;R85 Findings abnorm mat prov org digest cav Abdon;;
R86;;Abnormal findings in specimens from male genital organs;R86 Abnormal findings mat prov Male genital org;;
R87;;Abnormal findings in specimens from female genital organs;R87 Abnormal findings mat prov genital organ femal;;
R89;;material abnormal findings from other organs, devices, systems and tissues;R89 Found anorms mat after prov othe organic syst tec;;
R90;;Abnormal findings on diagnostic imaging of central nervous system;R90 exam Result abnorm diagn imag nerv syst centr;;
R91;;Abnormal findings on diagnostic imaging, lung;R91 Findings abnorm exams diagn image lung;;
R92;;Abnormal findings on diagnostic imaging, breast;R92 Findings abnorm exams diagn image of the breast;;
R93;;abnormal examination findings on diagnostic imaging of other body structures;R93 exam findings abnorm diagn imag rd October corp;;
R94;;abnormal results of function studies;R94 abnormal results of function studies;;
R95;;sudden death syndrome in childhood;R95 Sindr of sudden death in infancy;;
R96;;Other sudden deaths of unknown cause;R96 othe sudden deaths of unknown cause;;
R98;;Unattended deaths;R98 Death s / assist;;
R99;;Other ill-defined and unspecified causes of mortality;R99 othe ill-defined causes and mortality NE;;
S00;;Superficial injury of head;S00 Traum surface of the head;;
S01;;Head injury;S01 Ferim the head;;
S02;;skull fracture and facial bones;S02 Frat the skull and facial bones;;
S03;;Dislocation, sprain and strain of joints and ligaments of head;S03 Dislocation sprain distension artic linked head;;
S04;;Injury of cranial nerves;S04 Traum cranial nerve;;
S05;;Injury of eye and eye socket;S05 Traum eye and ocular orbits;;
S06;;intracranial trauma;S06 intracranial Traum;;
S07;;Crushing injury of head;Lesions S07 w / esmag the head;;
S08;;traumatic amputation of part of head;S08 Amput traum part of the head;;
S09;;Other injuries of the head and unspecified;S09 othe traum the head and NE;;
S10;;Superficial injury of the neck;S10 Traum surface of the neck;;
S11;;Neck injury;S11 Ferim the neck;;
S12;;Neck Fracture;S12 Frat's neck;;
S13;;Dislocation, sprain and strain of joints and ligaments at neck level;S13 Dislocation sprain distension artic linked neck;;
S14;;Injury of nerves and spinal cord at neck level;S14 Traum nerves cervical level spinal cord;;
S15;;Injury of blood vessels at neck level;S15 Traum level of the blood vessels of the neck;;
S16;;Injury of tendons and muscles of the neck;S16 Traum of tendons and muscles of the neck;;
S17;;Crushing injury of the neck;Lesions S17 w / neck esmag;;
S18;;Traumatic amputation at neck level;S18 Amput traum the level of the neck;;
S19;;Other injuries of the neck and unspecified;S19 othe traum the neck and NE;;
S20;;Superficial injury chest;S20 Traum surface of the chest;;
S21;;Chest injury;Ferim S21 of the chest;;
S22;;rib fracture (s), thoracic spine and sternum;Frat S22 ribs and thoracic spine sternum;;
S23;;Dislocation, sprain and strain of joints and ligaments of the chest;S23 Dislocation sprain distension linked artic the chest;;
S24;;Injuries of nerves and spinal cord at chest level;S24 Traum nerves and spinal cord level chest;;
S25;;Injury of blood vessels of the chest;S25 Traum of blood vessels of the chest;;
S26;;Injury of heart;S26 Traum's heart;;
S27;;Injury of other intrathoracic organs and unspecified;S27 Traum of othe intrathoracic organs and NE;;
S28;;Crushing injury of thorax and traumatic amputation of part of thorax;S28 Injury p / esmag chest Amput traum of chest;;
S29;;Other injuries of the chest and unspecified;S29 othe traum of the chest and NE;;
S30;;Superficial injury of abdomen, back and pelvis;S30 Traum surface of back abdomen and pelvis;;
S31;;Wound of abdomen, lower back and pelvis;S31 Ferim of back abdomen and pelvis;;
S32;;Fracture of lumbar spine and pelvis;Frat S32 lumbar spine and pelvis;;
S33;;Dislocation, sprain or strain of joints and ligaments of the lumbar spine and pelvis;Artic S33 Luxac entors dist linked al lumbar pelvis;;
S34;;Traumatic nerve and lumbar spinal cord at the level of the abdomen, lower back and pelvis;Nerv S34 Traum lumbar back abdomen pelvis med niv;;
S35;;Injury of blood vessels at abdomen level, lower back and pelvis;S35 Traum vessels sang level abdomen pelvis back;;
S36;;Injury of intra-abdominal organs;S36 Traum of intra-abdominal organs;;
S37;;Injury of urinary and pelvic organs;Traum S37 urinary tract and pelvic organs;;
S38;;Crushing injury and traumatic amputation of part of abdomen, lower back and pelvis;S38 injury w / esmag Amput traum part abd dors PELV;;
S39;;Other injuries and unspecified abdomen, lower back and pelvis;S39 othe traum and NE of the back abdomen and pelvis;;
S40;;Injury surface of the shoulder and arm;S40 Traum surface of the shoulder and arm;;
S41;;Injury of the shoulder and arm;S41 Ferim shoulder and arm;;
S42;;Fracture shoulder and arm;Frat S42 shoulder and arm;;
S43;;Dislocation, sprain and strain of joints and ligaments of the shoulder girdle;S43 Dislocation sprain distention artic linked radionuclide escape t;;
S44;;Injury of nerves at the shoulder and arm;S44 Traum nerves at the level of the shoulder and arm;;
S45;;Injury of blood vessels at the shoulder and arm;S45 Traum level of blood vessels shoulder arm;;
S46;;Injury of muscle and tendon at the shoulder and arm;Traum S46 shoulder tendon and muscle level arm;;
S47;;Crushing injury of shoulder and arm;S47 injury w / shoulder and arm esmag;;
S48;;Traumatic amputation arm and shoulder;S48 Amput traum shoulder and arm;;
S49;;Other injuries and unspecified shoulder and arm;S49 and othe traum shoulder and arm NE;;
S50;;surface of the elbow injury and forearm;S50 Traum surface of elbow and forearm;;
S51;;Injury forearm;S51 Ferim the forearm;;
S52;;Forearm Fracture;S52 Frat the forearm;;
S53;;Dislocation, sprain and strain of joints and ligaments of elbow;S53 Dislocation sprain distension artic linked elbow;;
S54;;Injury of nerves at forearm level;S54 Traum nerves at the level of the forearm;;
S55;;Injury of blood vessels at forearm level;S55 Traum blood vessels of the forearm level;;
S56;;muscle and tendon at forearm level;S56 Traum of muscle and tendon at forearm level;;
S57;;Crushing injury of forearm;S57 injury w / forearm esmag;;
S58;;traumatic amputation of elbow and forearm;S58 Amput traum elbow and forearm;;
S59;;Other injuries of the forearm and unspecified;S59 othe traum the forearm and NE;;
S60;;Injury surface of the wrist and hand;S60 Traum surface of wrist and hand;;
S61;;wrist and hand injury;S61 Ferim of wrist and hand;;
S62;;Fracture at wrist and hand level;S62 Frat the level of the wrist and hand;;
S63;;Dislocation, sprain and strain of joints and ligaments at wrist and hand;S63 Luxac entors distention artic linked niv hand fist;;
S64;;Injury of nerves at wrist and hand level;S64 Traum nerves at the level of wrist and hand;;
S65;;Injury of blood vessels at wrist and hand level;S65 Traum blood level wrist and hand vessels;;
S66;;muscle and tendon at wrist and hand level;S66 Traum of muscle and tendon level wrist and hand;;
S67;;Crushing injury of wrist and hand;S67 Injury p / wrist and hand esmag;;
S68;;Traumatic amputation of wrist and hand;S68 Amput traum the level of the wrist and hand;;
S69;;Other injuries and unspecified of the wrist and hand;S69 othe traum and NE of wrist and hand;;
S70;;superficial injury of hip and thigh;S70 Traum surface of the hip and thigh;;
S71;;Injury hip and thigh;S71 Ferim hip and thigh;;
S72;;femoral fracture;S72 Frat the femur;;
S73;;Dislocation, sprain and strain of joint and ligaments of hip;S73 Dislocation sprain distension linked hip artic;;
S74;;Injury of nerves at hip and thigh level;S74 Traum nerves at the level of the hip and thigh;;
S75;;Injury of blood vessels at hip and thigh level;S75 Traum blood vessels level hip and thigh;;
S76;;Injury of muscle and tendon at hip and thigh level;S76 Traum muscle and tendon level hip and thigh;;
S77;;Crushing injury of hip and thigh;S77 Injury p / esmag hip and thigh;;
S78;;Traumatic amputation of hip and thigh;S78 Amput traum hip and thigh;;
S79;;Other injuries and unspecified hip and thigh;S79 othe traum and NE hip and thigh;;
S80;;Injury surface of the leg;Traum surface S80 of the leg;;
S81;;Injury leg;S81 Ferim leg;;
S82;;Fracture leg, including the ankle;Frat S82 of leg ankle incl;;
S83;;Dislocation, sprain and strain of joints and ligaments of knee;S83 dislocation sprain distension linked art knee;;
S84;;Injury of peripheral nerves of the leg;S84 Traum of peripheral nerves of the leg;;
S85;;Injury of blood vessels of the leg;S85 Traum blood vessels of the leg;;
S86;;muscle tendon injuries and the level of the leg;Traum S86 muscle and tendon at the level leg;;
S87;;Injury by crushing leg;S87 Traum w / leg esmag;;
S88;;Traumatic amputation leg;Traum leg S88 Amput;;
S89;;Other injuries and unspecified leg;Traum S89 and othe leg NE;;
S90;;Superficial injury of the ankle and foot;S90 Traum surface of ankle and foot;;
S91;;Injuries of ankle and foot;S91 Ferim of ankle and foot;;
S92;;Fracture of the foot (except ankle);S92 pe Frat;;
S93;;Dislocation, sprain and strain of joints and ligaments at ankle and foot level;S93 Luxac entors distention artic linked niv tornoz pe;;
S94;;Injury of nerves at ankle and foot level;S94 Traum nerve at the level of the ankle and foot;;
S95;;Injury of blood vessels at ankle and foot level;S95 Traum blood vessels level ankle and foot;;
S96;;Injuries to the muscle and tendon at ankle and foot level;S96 Traum muscle and tendon and ankle level pe;;
S97;;Crushing injury of ankle and foot;S97 Injury p / esmag ankle and foot;;
S98;;traumatic amputation of ankle and foot;S98 Amput traum of ankle and foot;;
S99;;Other injuries and unspecified ankle and foot;S99 othe traum and NE of ankle and foot;;
T00;;Superficial injuries involving multiple body regions;T00 Traum surface Wreath mult body regions;;
T01;;Injuries involving multiple body regions;T01 Ferim Wreath mult regions of the body;;
T02;;Fractures involving multiple body regions;T02 Frat Wreath mult regions of the body;;
T03;;Dislocations, sprains and strains involving multiple body regions;T03 Luxac entors distension Wreath reg body mult;;
T04;;Injuries by crushing involving multiple body regions;T04 Traum w / esmag Wreath Multi body regions;;
T05;;Traumatic amputations involving multiple body regions;T05 Amput traum Wreath mult regions of the body;;
T06;;Other injuries involving multiple body regions, not elsewhere classified;T06 othe traum Wreath mult regions of the body NCOP;;
T07;;multiple injuries not specified;T07 Traum mult NE;;
T08;;Fracture of spine, level unspecified;T08 level of NE column Frat;;
T09;;Other injuries of spine and trunk, level unspecified;T09 traum column and othe level trunk NE;;
T10;;upper limb fracture, level unspecified;T10 Super Frat level NE member;;
T11;;Other injuries of upper limb, level unspecified;T11 othe traum super level NE member;;
T12;;lower limb fracture, level unspecified;T12 Frat infer the level NE member;;
T13;;Other injuries of lower limb, level unspecified;T13 othe traum infer the level NE member;;
T14;;Injury of unspecified body region;T14 region of NE Traum body;;
T15;;Foreign body on the outside of the eye;T15 Foreign body on the outside of the eye;;
T16;;in your ear;T16 Foreign body in ear;;
T17;;Foreign body in respiratory tract;T17 Foreign body in Respiratory tract;;
T18;;Foreign body in the digestive tract;T18 Foreign body in digestive system;;
T19;;Foreign body in genitourinary tract;T19 Foreign body in genitourinary tract;;
T20;;Burn and corrosion of head and neck;T20 BURN and corrosion of head and neck;;
T21;;Burn and corrosion of trunk;T21 BURN and corrosion of trunk;;
T22;;Burn and corrosion of shoulder and upper limb, except wrist and hand;BURN T22 corrosion shoulder Membr sup hand grip exc;;
T23;;Burn and corrosion of wrist and hand;T23 BURN and corrosion of wrist and hand;;
T24;;Burn and corrosion of hip and lower limb, except ankle and foot;T24 BURN corrosion Wood Frame member inf exc tornoz pe;;
T25;;Burn and corrosion of ankle and foot;T25 BURN and corrosion of ankle and foot;;
T26;;Burn and corrosion limited to the eye and its annexes;BURN T26 and limited corrosion to the eye and attachments;;
T27;;Burn and corrosion of respiratory tract;T27 BURN and corrosion of Respiratory tract;;
T28;;Burn and corrosion of other internal organs;T28 BURN and corrosion of internal organs othe;;
T29;;Burns and corrosions of multiple body regions;T29 BURN and corrosion of mult regions of the body;;
T30;;Burn and corrosion of unspecified body;T30 BURN and corrosion NE part of the body;;
T31;;Burns classified according to extent of body surface;T31 BURN classif sec ext body surface ating;;
T32;;Corrosion classified according to the extent of body surface;T32 corrosion classif sec ext surface Corp. ating;;
T33;;surface frostbite;T33 Frostbite surface;;
T34;;Frostbite with tissue necrosis;T34 frostbite w / necrosis tec;;
T35;;Frostbite multiple body parts and unspecified;T35 Frostbite mult body parts and NE;;
T36;;Poisoning by systemic antibiotics;T36 Intox w / systemic antibiotics;;
T37;;Poisoning by other anti-infective substances or systemic antiparasitic;T37 Intox othe subst antiinfecc antiparasit sist;;
T38;;Poisoning by hormones and their synthetic substitutes and antagonists, not elsewhere classified;T38 Intox p / hormones your subst sint antag NCOP;;
T39;;Poisoning analgesic, antipyretic and antirheumatic non-opioid;T39 Intox analges antipiret anti-rheumatoid n-OPIAC;;
T40;;Poisoning by narcotics and psychodysleptics [hallucinogens];T40 Intox w / narcotics and psychodysleptics;;
T41;;Poisoning by anesthetics and therapeutic gases;T41 Intox w / anesthetics and therapeutic gases;;
T42;;Poisoning by antiepileptic, sedative-hypnotics;T42 Intox antiepilept sedativ-hipnot antiparkins;;
T43;;Poisoning by psychotropic drugs, not elsewhere classified;T43 Intox p / psychotropic drugs NEC;;
T44;;Poisoning by drugs primarily affecting the autonomic nervous system;T44 Intox p / q offwhite AFET autonomous nerv syst Princ;;
T45;;Poisoning by primarily systemic and haematological agents, not elsewhere classified;T45 Intox subst action ess sist subst hematol NCOP;;
T46;;Poisoning by agents primarily affecting the cardiovascular system;T46 Intox subst working on prim after circulat;;
T47;;Poisoning by acting primarily on the gastrointestinal tract;T47 Intox w / subst operating prim s / hc gastroint;;
T48;;Poisoning by agents primarily on smooth and skeletal muscles and the respiratory system;T48 Intox subst q prim at left flat after resp musc;;
T49;;Poisoning by topical agents primarily on the skin and mucous membranes and drugs used in ophthalmology, otolaryngology and dentistry;Int T49 subs use top pel muc med ut oft otor odo;;
T50;;Poisoning by diuretics and other drugs, medicaments and biological substances and unspecified;T50 Intox diuret October drog medic subst biolog NE;;
T51;;Toxic effect of alcohol;T51 effect of alcohol toxico;;
T52;;Toxic effect of organic solvents;T52 Toxic effect of organic solvents;;
T53;;Toxic effect halogenic derivatives of aliphatic and aromatic hydrocarbons;Effect T53 tox deriv Halog hidrocarb aliphatic arom;;
T54;;Toxic effect of corrosive;T54 toxic effect of corrosive;;
T55;;Toxic effect of soaps and detergents;T55 Toxic effect of soaps and detergents;;
T56;;Toxic effect of metals;Effect of toxic metals T56;;
T57;;Toxic effect of other inorganic substances;T57 toxic effect of inorganic subst othe;;
T58;;Toxic effect of carbon monoxide;T58 toxic effect of carbon monoxide;;
T59;;Toxic effect of other gases, fumes and vapors;T59 toxic effect of gas fumes vapors othe;;
T60;;Toxic effect of pesticides;T60 Toxic effect of pesticides;;
T61;;Toxic effect of noxious substances consumed as a result of the sea;Subst harmful effect tox T61 as a result March cf.;;
T62;;Toxic effect of other harmful substances ingested as food;Effect T62 tox othe subst noc inger as aliment;;
T63;;Toxic effect of contact with venomous animals;T63 effect Contact c toxic / poisonous animals;;
T64;;Toxic effect of aflatoxin and other food contaminants mycotoxins;Effect T64 tox aflatox othe micotox sup count;;
T65;;Toxic effect of other and unspecified substances;Toxic effect of T65 and NS subst othe;;
T66;;Unspecified effects of radiation;T66 Effects of radiation NE;;
T67;;Effects of heat and light;T67 Effects of heat and light;;
T68;;Hypothermia;T68 Hypothermia;;
T69;;Other effects of reduced temperature;T69 othe effects of reduced temperature;;
T70;;Effects of atmospheric pressure and water pressure;T70 Effects atmospheric pressure and water pressure;;
T71;;asphyxia;T71 Asphyxiation;;
T73;;Effects of other deprivation;T73 Effects of Other Options privations;;
T74;;Syndromes of abuse;T74 Sindr of abuse;;
T75;;Effects of other external causes;T75 Effects of external causes othe;;
T78;;adverse effects not elsewhere classified;T78 Adverse effects NCOP;;
T79;;Certain early complications of trauma not elsewhere classified;T79 Certain early Complicated traum of the NCOP;;
T80;;Complications resulting infusion, transfusion and therapeutic injection;T80 Complicated conseq infusion transfusion injection ther;;
T81;;Complications procedures not elsewhere classified;Complicated T81 of proced NCOP;;
T82;;Complications of prosthetic devices, implants and cardiac and vascular grafts;T82 Complicated operative prot impl enxert card and vasc;;
T83;;Complications of prosthetic devices, implants and grafts genitourinary;T83 Complicated operative prot impl enx geniturin int;;
T84;;Complications of prosthetic devices, orthopedic implants and grafts;T84 Complicated operative prot impl enx ortopedicos int;;
T85;;Complications of other prosthetic devices, implants and grafts;T85 Complicated othe prosthetic operative impl enx int;;
T86;;Failure and rejection of transplanted organs and tissues;T86 Failure and rejection organs transplanted tec;;
T87;;own complications replantation and amputation;T87 Complicated own replantation and Amput;;
T88;;Other complications of surgical and medical care, not elsewhere classified;T88 othe Complicated surg medical care NEC;;
T90;;Sequelae of head trauma;T90 Sequelae of the head traum;;
T91;;Sequelae of injuries of the neck and trunk;T91 Sequelae of traum of neck and trunk;;
T92;;sequelae of trauma of the upper limb;T92 Sequelae of super member traum;;
T93;;Sequelae of lower limb injuries;T93 Sequelae of member infer traum;;
T94;;Sequelae of injuries involving multiple body regions and unspecified;T94 Sequelae traum Wreath mult reg body and NE;;
T95;;Sequelae of burns, corrosions and frostbite;T95 Sequelae of burnt corrosion and frostbite;;
