CAT;CLASSIF;DESCRICAO;DESCRABREV;REFER;EXCLUIDOS
N03;;Chronic nephritic syndrome;N03 Sindr chronic nephritic;;
N04;;Nephrotic syndrome;N04 Sindr nephrotic;;
N05;;nephritic syndrome, unspecified;N05 Sindr nephritic NE;;
N06;;Proteinuria isolated with specified morphological lesion;Proteinuria isolated N06 w / lesion specific Morphology;;
N07;;Nephropathy hereditary not elsewhere classified;N07 hereditary nephropathy NEC;;
N08;*;Glomerular disorders in diseases classified elsewhere;N08 Transt glomerular in Thyroid Disease COP;;
N10;;Acute tubulointerstitial nephritis;N10 Acute tubulointerstitial nephritis;;
N11;;Chronic interstitial nephritis;N11 chronic interstitial nephritis;;
N12;;Interstitial nephritis not specified as acute or chronic;N12 acute tubulointerstitial nephritis, chronic NE;;
N13;;obstructive uropathy and reflux;Obstructive uropathy N13 p / reflux;;
N14;;tubular and tubulointerstitial disorders induced by drugs or heavy metals;N14 Aphek tubulo-ind interst Organ Pipe offwhite meth dang;;
N15;;Other renal tubulo-interstitial diseases;Thyroid Disease N15 othe renal tubulointerstitial;;
N16;*;tubulointerstitial disorders in diseases classified elsewhere;N16 Transt tubulo-interstitial kidney Thyroid Disease COP;;
N17;;Acute renal failure;N17 acute renal Insuf;;
N18;;chronic renal failure;N18 Insuf chronic kidney;;
N19;;unspecified renal failure;N19 kidney Insuf NE;;
N20;;Calculus of kidney and ureter;N20 Calculus of kidney and ureter;;
N21;;Calculus of lower urinary tract;N21 Calculus of urinary tract infer;;
N22;*;Calculus of lower urinary tract in diseases classified elsewhere;N22 Calculus of urinary tract infer Thyroid Disease COP;;
N23;;Unspecified colic nephretic;N23 Colica nephretic NE;;
N25;;Disorders resulting from altered renal tubular function;N25 Transt result altered renal tubular function;;
N26;;Contracted kidney, unspecified;N26 Rim contracted NE;;
N27;;renal hypoplasia of unknown cause;N27 renal hypoplasia of unknown cause;;
N28;;Other disorders of kidney and ureter, not elsewhere classified;N28 othe transt kidney and ureter NEC;;
N29;*;Other disorders of kidney and ureter in diseases classified elsewhere;N29 othe transt of kidney and ureter in Thyroid Disease COP;;
N30;;cystitis;N30 Cystitis;;
N31;;neuromuscular dysfunction of bladder, not elsewhere classified;N31 Neuromuscular dysfunction of bladder NEC;;
N32;;Other disorders of bladder;N32 othe transt bladder;;
N33;*;bladder disorders in diseases classified elsewhere;N33 Transt bladder in Thyroid Disease COP;;
N34;;Urethritis and urethral syndrome;N34 Urethritis and urethral sindr;;
N35;;Urethral stricture;N35 Urethral stricture;;
N36;;Other urethral disorders;N36 othe transt the urethra;;
N37;*;Urethral disorders in diseases classified elsewhere;N37 Urethral Transt in Thyroid Disease COP;;
N39;;Other disorders of the urinary tract;N39 othe transt urinary tract;;
N40;;Prostate Hyperplasia;N40 Hyperplasia of prostate;;
N41;;inflammatory diseases of prostate;N41 Thyroid Disease inflate prostate;;
N42;;Other prostate affections;N42 othe disorders of prostate;;
N43;;Hydrocele and spermatocele;N43 Hydrocele and spermatocele;;
N44;;Torsion of the testis;N44 torsion of the testis;;
N45;;Orchitis and epididymitis;N45 Orchitis and epididymitis;;
N46;;male infertility;N46 Male Infertility;;
N47;;foreskin hypertrophy, phimosis and paraphimosis;N47 Hypertrophy of the foreskin phimosis and paraphimosis;;
N48;;Other disorders of penis;N48 othe transt penis;;
N49;;Inflammatory disorders of male genital organs, not elsewhere classified;N49 Transt inflate genitals Male NEC;;
N50;;Other disorders of male genital organs;N50 othe transt of genitals Male;;
N51;*;Disorders of male genital organs in diseases classified elsewhere;N51 Transt genitals Male Thyroid Disease COP;;
N60;;benign mammary dysplasias;N60 benign mammary dysplasias;;
N61;;inflammatory breast disorders;N61 inflate breast Transt;;
N62;;breast enlargement;N62 breast hypertrophy;;
N63;;breast lump unspecified;N63 breast lump NE;;
N64;;Other breast diseases;Thyroid Disease breast N64 othe;;
N70;;Salpingitis and oophoritis;N70 salpingitis and oophoritis;;
N71;;Inflammatory disease of uterus, except cervix;N71 Thyroid Disease inflate the uterus except cervix;;
N72;;inflammatory disease of the cervix;N72 Thyroid Disease inflate the cervix;;
N73;;Other female pelvic inflammatory diseases;N73 othe Thyroid Disease inflate pelvic femal;;
N74;*;inflammatory disorders of the female pelvis in diseases classified elsewhere;N74 Transt inflate the femal pelvis Thyroid Disease COP;;
N75;;Bartholin gland diseases;N75 Thyroid Disease of Bartholin gland of;;
N76;;Other inflammatory diseases of the vagina and vulva;N76 othe inflate disorders of the vagina and vulva;;
N77;*;Vulvovaginal ulceration and inflammation in diseases classified elsewhere;N77 Vulvovaginal ulceration and inflate Thyroid Disease COP;;
N80;;endometriosis;N80 Endometriosis;;
N81;;female genital prolapse;N81 genital prolapse femal;;
N82;;the female genital tract fistulae;N82 Fistulas of femal genital tract;;
N83;;non-inflammatory disorders of the ovary, fallopian tube and broad ligament;N83 non-infl ovary Transt Tromp off linked Falop;;
N84;;the female genital tract polyp;N84 Polyp of femal genital tract;;
N85;;Other noninflammatory disorders of uterus, except cervix;N85 transt othe non-inflating uterus cervix uterus exc;;
N86;;Erosion and cervical ectropion;N86 Erosion and ectropion of cervix;;
N87;;Cervical Dysplasia;N87 Dysplasia of cervix;;
N88;;Other noninflammatory disorders of cervix uteri;N88 transt othe non-inflating cervical;;
N89;;Other noninflammatory disorders of the vagina;N89 transt othe non-inflating the vagina;;
N90;;Other noninflammatory disorders of vulva and perineum;N90 transt othe non-inflating vulva and perineum;;
N91;;Menstruation absent, scarce and infrequent;N91 little bit absent menstruation and freq;;
N92;;Excessive menstruation frequently and irregularly;N92 often excessive and irregular menstruation;;
N93;;Other abnormal bleeding from the uterus and vagina;N93 othe abnormal bleeding uterus and vagina;;
N94;;Pain and other conditions associated with female genital organs and menstrual cycle;N94 Pain othe AFECC ass org genit fem Krebs Cycle menstr;;
N95;;Menopausal Disorders and perimenopause;N95 Transt of menopause and perimenopause;;
N96;;habitual abortion;N96 habitual abortion;;
N97;;female infertility;N97 Feminine Infertility;;
N98;;Complications associated with artificial insemination;N98 Complicated assoc artificial insemination;;
N99;;genitourinary disorders post-procedures not elsewhere classified;N99 Transt genitourinary tract post-proced NEC;;
O00;;Ectopic pregnancy;O00 Pregnancy ectopic;;
O01;;molar pregnancy;O01 Spring hydatiform;;
O02;;Other abnormal products of conception;O02 othe abnormal products of conception;;
O03;;miscarriage;O03 spontaneous abortion;;
O04;;Abortion for medical and legal reasons;O04 Abortion p / medical and legal reasons;;
O05;;Other types of abortion;O05 othe types of abortion;;
O06;;Unspecified abortion;O06 Abortion NE;;
O07;;Failed abortion attempt;O07 abortion attempt failed;;
O08;;Complications following abortion and ectopic or molar pregnancy;Complicated abortion O08 conseq molar pregnancy ectop;;
O10;;Pre-existing hypertension complicating pregnancy, childbirth and the postpartum period;O10 Hypertension pre-exist Complicated grav delivery puerp;;
O11;;Disorder pre-existing hypertension with proteinuria superimposed;O11 Dist hypertension pre-exist proteinuria superp;;
O12;;Edema and proteinuria Gestational [pregnancy-induced] hypertension without;Gestational edema and proteinuria O12 S / hypertension;;
O13;;Gestational Hypertension [pregnancy-induced] without significant proteinuria;Gestational hypertension O13 S / proteinuria significance;;
O14;;Gestational Hypertension [pregnancy-induced] with significant proteinuria;O14 gestational hypertension w / proteinuria significance;;
O15;;Eclampsia;O15 Eclampsia;;
O16;;Unspecified maternal hypertension;O16 Maternal Hypertension NE;;
O20;;of early pregnancy bleeding;O20 Haemorrhage in early pregnancy;;
O21;;Excessive vomiting in pregnancy;O21 Excessive vomiting in pregnancy;;
O22;;Venous complications in pregnancy;O22 Venous Complicated Pregnancy;;
O23;;Infections of the genitourinary tract in pregnancy;O23 infection due genitourinary tract in pregnancy;;
O24;;Diabetes mellitus in pregnancy;O24 Diabetes mellitus in pregnancy;;
O25;;Malnutrition in pregnancy;O25 Desnutric in pregnancy;;
O26;;Maternal care for other conditions predominantly related to pregnancy;O26 Assist maternal othe Complicated linked Mostly grav;;
O28;;"abnormal screening findings [ ""screening""] mother's antenatal";O28 findings abnorm Rastr antenatal mother;;
O29;;administered anesthesia complications during pregnancy;O29 Complicated admin anesthesia during pregnancy;;
O30;;multiple pregnancy;O30 pregnancy mult;;
O31;;complications specific to multiple gestation;O31 specific Complicated of gestation mult;;
O32;;Maternal care because of freak show, known or suspected fetal;Assist O32 Perst mother apres abnorm CONH fetus susp;;
O33;;Maternal care for known or suspected disproportion;O33 Assist perst mother known desprop suspected;;
O34;;Maternal care for abnormality, known or suspected of maternal pelvic organs;O34 Assist perst mother anor Cognac susp org PELV mat;;
O35;;Maternal care for abnormality and fetal injury, known or suspected;O35 Assist perst mother abnorm lesion fet cognitiv susp;;
O36;;Maternal care for other known or suspected fetal problems;O36 Assist perst mother othe probl fet cognitiv susp;;
O40;;polyhydramnios;O40 polyhydramnios;;
O41;;Other disorders of the membranes and amniotic fluid;O41 othe membranes and amniotic fluid transt;;
O42;;Premature Rupture of Membranes;Premature rupture of membranes O42;;
O43;;placental disorders;O43 Transt placenta;;
O44;;placenta previa;O44 Placenta provided;;
O45;;placental abruption [abruptio placentae];O45 Detachment placental;;
O46;;Antepartum hemorrhage not elsewhere classified;O46 Antepartum haemorrhage NEC;;
O47;;False labor;O47 False labor;;
O48;;prolonged Pregnancy;Pregnancy prolonged O48;;
O60;;preterm labor;O60 pre-term labor work;;
o61;;Failure of labor induction;O61 failed induction of labor;;
O62;;Abnormalities of uterine contraction;O62 Abnormalities of uterine contraction;;
ø63;;Prolonged labor;Prolonged labor Ø63;;
O64;;Obstructed labor due to bad position or bad presentation of the fetus;Work delivery O64 Paper Jam dev ma-ma-apres fetus Posit;;
O65;;Obstructed labor due to pelvic abnormality mother;O65 Paper Jam Job delivery dev pelvic abnorm of mother;;
O66;;Other forms of labor obstruction;O66 othe obstruction of form of labor;;
O67;;labor and delivery complicated by intrapartum hemorrhage not elsewhere classified;O67 Job childbirth delivery compl hemorr intrapart NCOP;;
O68;;Labor and delivery complicated by fetal distress;Job O68 labor and delivery fetal distress Complicated;;
O69;;Labor and delivery complicated by abnormal cord;O69 Job childbirth delivery compl abnorm Cordao umbilic;;
O70;;Lacerations of the perineum during childbirth;O70 laceration of the perineum during childbirth;;
O71;;Other injuries obstetric;O71 othe traum obstetric;;
o72;;postpartum hemorrhage;O72 postpartum haemorrhage;;
O73;;Retained placenta and membranes without bleeding;Retention placenta and O73 S / bleeding membranes;;
O74;;Complications of anesthesia during labor and delivery;O74 Complicated Job anesthesia during labor and delivery;;
O75;;Other complications of labor and delivery, not elsewhere classified;O75 othe Day Job Complicated labor and delivery NEC;;
O80;;Spontaneous delivery single;O80 single spontaneous Childbirth;;
O81;;Delivery only by forceps or vacuum extractor;O81 single birth w / forceps or vacuum extractor;;
O82;;only cesarean delivery;O82 single birth w / caesarean;;
O83;;Other types of assisted single delivery;O83 othe types of assisted single delivery;;
O84;;multiple birth;O84 Childbirth mult;;
O85;;puerperal infection;O85 infection due puerperal;;
O86;;Other puerperal infections;O86 othe puerperal infection due;;
O87;;Venous complications in the puerperium;O87 Complicated venous in puerperium;;
O88;;Embolism obstetric origin;O88 Embolism orig obstetric;;
O89;;Complications of anesthesia administered during the puerperium;O89 Complicated admin anesthesia during the puerperium;;
O90;;puerperium Complications not elsewhere classified;O90 Complicated the puerperium NEC;;
O91;;mammary infections associated with childbirth;O91 infection due mammary assoc childbirth;;
O92;;Other disorders of breast and lactation associated with childbirth;O92 othe disorders breast and lactation assoc childbirth;;
O94;;Sequelae of complications of pregnancy, childbirth and postpartum;O94 Sequelae Complicated pregnancy and puerperium;;
O95;;Obstetric death of unspecified cause;O95 obstetric Death cause NE;;
O96;;Death from any obstetric cause occurring more than 42 days but less than one year after delivery;O96 Death qq caus obst more 42d least first delivery;;
O97;;Death from sequelae of direct obstetric causes;O97 Death w / sequelae direct obstetric causes;;
O98;;infectious diseases and maternal parasitic classifiable elsewhere but complicating pregnancy, childbirth and the postpartum period;Disease O98 inf paras mat COP compl part REC puerp;;
O99;;Other mother's diseases classified elsewhere but complicating pregnancy, childbirth and the postpartum period;O99 othe Thyroid Disease mat COP compl grav delivery puerp;;
P00;;Fetus and newborn affected by maternal conditions that may be related to the current pregnancy;P00 rec-born Fet AFET AFEC mat n obr rel at grav;;
P01;;Fetus and newborn affected by maternal complications of pregnancy;P01 Fet newly born AFET Complicated maternal pregnancy;;
P02;;Fetus and Newborn affected by complications of placenta, cord and membranes;P02 Fet newly born AFET compl plac cord umb Membr;;
P03;;Fetus and newborn affected by other complications of labor and delivery;P03 Fet newly born AFET October compl Job childbirth delivery;;
P04;;Fetus and Newborn affected by noxious influences transmitted via placenta or breast milk;P04 Fet newly born infl af noc trans plac leit mat;;
P05;;fetal growth retardation and fetal malnutrition;P05 retard fetal growth and fetal desnutric;;
P07;;Disorders related to short gestation and low birth weight, not elsewhere classified;P07 Transt rel curt management dur weight baix born NCOP;;
P08;;Disorders related to long gestation and high birth weight;P08 Transt management RELAC high weight born prolong;;
P10;;Intracranial laceration and haemorrhage due to birth injury;P10 laceration intracran hemorrag dev traum delivery;;
P11;;Other birth injuries of the central nervous system;P11 othe delivery traum central nervous syst;;
P12;;Injury of the scalp due to birth injury;P12 injury scalp dev delivery traum;;
P13;;skeletal injuries due to birth injury;P13 skeletal lesions dev delivery traum;;
P14;;Birth injury of peripheral nervous system;P14 Lesions birth peripheral nervous syst;;
P15;;Other birth injuries;P15 othe delivery traum;;
P20;;intrauterine hypoxia;P20 Intrauterine hypoxia;;
P21;;Birth asphyxia;P21 asphyxia at birth;;
P22;;Discomfort (anxiety) respiratory (a) Newborn;P22 Respiratory Distress of newborn;;
P23;;congenital pneumonia;P23 Pneumonia congen;;
P24;;aspiration syndrome neonatal;P24 Sindr of neonatal aspiration;;
P25;;interstitial emphysema and related conditions originating in the perinatal period;P25 Emphysema interst AFECC corr orig per Perinat;;
P26;;Pulmonary haemorrhage originating in the perinatal period;P26 Pulmonary haemorrhage orig perinatal period;;
P27;;Chronic respiratory disease originating in the perinatal period;P27 Thyroid Disease Respiratory cron orig perinatal period;;
P28;;Other respiratory conditions originating in the perinatal period;P28 Respiratory disorders othe orig per perinatal;;
P29;;cardiovascular disorders originating in the perinatal period;P29 Transt cardiovasc orig perinatal period;;
P35;;congenital viral diseases;Thyroid Disease P35 viral congen;;
P36;;bacterial sepsis of newborn;P36 Septicemia bacter of newborn;;
P37;;Other congenital infectious and parasitic diseases;P37 othe Thyroid Disease and infection due parasit congen;;
P38;;Omphalitis newborn with or without mild haemorrhage;P38 Omphalitis newly born w / or w / mild haemorrhage;;
P39;;Other infections specific to the perinatal period;P39 othe specific infection due to the perinatal period;;
P50;;fetal blood loss;P50 fetal blood loss;;
P51;;umbilical haemorrhage of newborn;P51 Umbilical haemorrhage of newborn;;
P52;;intracranial hemorrhage nontraumatic of fetus and newborn;P52 bleeding non-traum newly born fetal intracran;;
P53;;hemorrhagic disease of fetus and newborn;Thyroid Disease hemorrhagic P53 fetus and newborn;;
P54;;Other neonatal haemorrhages;P54 othe neonatal bleeding;;
P55;;hemolytic disease of the fetus and newborn;Thyroid Disease hemolytic P55 of the fetus and newborn;;
P56;;fetal hydrops due to hemolytic disease;P56 fetal hydrops dev hemolytic Thyroid Disease;;
P57;;kernicterus;P57 Kernicterus;;
P58;;Neonatal jaundice due to other excessive haemolysis;P58 bile duct neonatal dev othe excess hemolysis;;
P59;;Neonatal jaundice due to other causes and unspecified;P59 bile duct neonatal dev othe causes and NE;;
P60;;Disseminated intravascular coagulation of fetus and newborn;P60 coagulation intravasc newly born fetal dissem;;
P61;;Other perinatal haematological disorders;P61 othe transt perinatal haematological;;
P70;;transient disorders of the metabolism of carbohydrates specific to fetus and newborn;Trans P70 transit Metab carboid esp FET newly born;;
P71;;transient disorders of metabolism of calcium and magnesium in the neonatal period;P71 Transt transit metab calcio magnetic per neonat;;
P72;;Other transitory neonatal endocrine disorders period;P72 othe transt endocrine transit period neonat;;
P74;;Other transitory electrolyte and metabolic disorders of neonatal period;P74 othe dist eletrolit metab transit per neonat;;
P75;*;meconium ileus;P75 Ileo meconium;E84.1 +;
P76;;Other intestinal obstruction of newborn;P76 othe intestinal obstructions of newborn;;
P77;;necrotizing enterocolitis of fetus and newborn;Necrotizing enterocolitis P77 fetus and newly born;;
P78;;Other disorders of the digestive system of the perinatal period;P78 othe transt digestive after perinatal period;;
P80;;Hypothermia of newborn;P80 Hypothermia of newborn;;
P81;;Other thermal regulation disorders of the newborn;P81 othe disorders regulation rec-born thermal;;
P83;;Other conditions of integument specific to fetus and newborn;P83 othe AFECC compose tegum specific fetal newly born;;
P90;;Convulsions of newborn;P90 Convulsions of newborn;;
P91;;Other brain function disorders of the newborn;P91 othe brain function disorders newly born;;
P92;;Newborn feeding problems;P92 feeding problems of newborn;;
P93;;Reactions and intoxications due to drugs administered to fetus and newborn;P93 Reactions and intox dev drog admin fetus newly born;;
P94;;Disorders of muscle tone of newborn;P94 Transt muscle tone of newborn;;
P95;;Fetal death of unspecified cause;P95 cause fetal death NE;;
P96;;Other conditions originating in the perinatal period;P96 othe conditions originating perinatal;;
Q00;;Anencephaly and similar malformations;Q00 Anencephaly and similar malformations;;
Q01;;encephalocele;Q01 encephalocele;;
Q02;;Microcephaly;Q02 microcephaly;;
Q03;;congenital hydrocephalus;Q03 Hydrocephalus congen;;
Q04;;Other congenital malformations of brain;Q04 othe congen malformations of the brain;;
Q05;;Spina bifida;Q05 spine bifida;;
Q06;;Other congenital malformations of spinal cord;Q06 othe spinal cord malformations congen;;
Q07;;Other congenital malformations of the nervous system;Q07 othe congen malformations of the nervous syst;;
Q10;;Congenital malformations of eyelid, lacrimal system and orbit;Q10 Malform congen eyelids tear after orbits;;
Q11;;Anophthalmia, microphthalmia and macrophthalmos;Q11 Anophthalmos microphthalmia and macrophthalmos;;
Q12;;Congenital malformations of the lens;Q12 malformations congen lens;;
Q13;;Congenital malformations of the anterior chamber of the eye;Q13 malformations congen the eye's anterior chamber;;
Q14;;Congenital malformations of the posterior chamber of the eye;Q14 malformations congen later chamber of the eye;;
Q15;;Other congenital malformations of eye;Q15 othe eye malformations congen;;
Q16;;congenital malformations of ear causing hearing impairment;Q16 Malform congen caus heard compose audition;;
Q17;;Other congenital malformations of ear;Q17 othe congen ear malformations;;
Q18;;Other congenital malformations of face and neck;Q18 othe congen malformations of the face and neck;;
Q20;;Congenital malformations of the heart chambers and communications;Q20 Malform congen cameras and communications card;;
Q21;;Congenital malformations of cardiac septa;Q21 congen malformations of cardiac septa;;
Q22;;Congenital malformations of pulmonary and tricuspid valves;Q22 Malform congen pulmonary valves tricuspide;;
Q23;;Congenital malformations of the aortic and mitral;Q23 malformations congen aortic and mitral valves;;
Q24;;Other congenital malformations of heart;Q24 othe congen malformations of the heart;;
Q25;;Congenital malformations of great arteries;Q25 congen malformations of the great arteries;;
Q26;;Congenital malformations of great veins;Q26 congen malformations of great veins;;
Q27;;Other congenital malformations of peripheral vascular system;Q27 othe malformations congen sist vasc peripherals;;
Q28;;Other congenital malformations of circulatory system;Q28 othe malform circulatory system congen;;
Q30;;Congenital malformation of the nose;Q30 malformation congen nose;;
Q31;;Congenital malformations of the larynx;Q31 congen malformations of the larynx;;
Q32;;Congenital malformations of trachea and bronchus;Q32 malformations congen trachea and bronchi;;
Q33;;congenital malformations of lung;Q33 congen malformations of lung;;
Q34;;Other congenital malformations of the respiratory system;Q34 othe malformations Respiratory appliance congen;;
Q35;;cleft palate;Q35 Cleft palate;;
Q36;;cleft lip;Q36 Cleft lip;;
Q37;;cleft lip with cleft palate;Q37 c cleft lip / cleft palate;;
Q38;;Other congenital malformations of tongue, mouth and pharynx;Q38 othe malform congen language mouth and pharynx;;
Q39;;congenital malformations of esophagus;Q39 congen malformations of esophagus;;
Q40;;Other congenital malformations of the upper digestive tract;Q40 othe malform congen super digestive tract;;
Q41;;Absence, congenital atresia and stenosis of small bowel;Q41 Absence atresia stenosis congen intest delg;;
Q42;;Absence, congenital atresia and stenosis of the colon;Q42 Absence atresia and stenosis of the colon congen;;
Q43;;Other congenital malformations of intestine;Q43 othe malformations bowel congen;;
Q44;;Congenital malformations of gallbladder, bile ducts and liver;Q44 Malform congen Vesic biliary bile Liver;;
Q45;;Other congenital malformations of digestive system;Q45 othe congen digestive tract malformations;;
Q50;;Congenital malformations of ovaries, fallopian tubes and broad ligaments;Q50 Malform cong ovary tromp linked broad fallopian;;
Q51;;Congenital malformations of the uterus and cervix;Q51 malformations congen utero and cervix;;
Q52;;Other congenital malformations of female genitalia;Q52 othe genital malformations congen org femal;;
Q53;;non-descended testicle;Non-descended testis Q53;;
Q54;;hypospadias;Q54 Hypospadias;;
Q55;;Other congenital malformations of male genital organs;Q55 othe genital malformations congen org Male;;
Q56;;Indeterminate sex and pseudohermaphroditism;Q56 Indeterminate sex and pseudohermaphroditism;;
Q60;;Kidney Renal agenesis and other reduction defects;Q60 Renal agenesis and othe reduction kidney defects;;
Q61;;kidney cystic diseases;Q61 Thyroid Disease cystic kidney;;
Q62;;obstructive congenital anomalies of the renal pelvis and congenital malformations of ureter;Q62 Anom cong JAM kidney ureter PELV malf cong;;
Q63;;Other congenital malformations of kidney;Q63 othe congen kidney malformations;;
Q64;;Other congenital malformations of urinary system;Q64 othe urinary tract malformations congen;;
Q65;;Congenital malformations of the hip;Q65 malformations congen hip;;
Q66;;congenital deformities of the foot;Q66 Deform pe congen;;
Q67;;musculoskeletal congenital deformities of the head, face and chest of the column;Q67 deform osteom head face chest column cong;;
Q68;;Other congenital musculoskeletal deformities;Q68 othe deform musculoskeletal congen;;
Q69;;polydactyly;Q69 Polydactyly;;
Q70;;syndactyly;Q70 Syndactyly;;
Q71;;Defects by reduction of the upper limb;Q71 Defects p / super member reduction;;
Q72;;Defects by reduction, lower limb;Q72 Defects p / member of the reduction infer;;
Q73;;Defects by reducing member unspecified;Q73 Defects p / reduction of NE member;;
Q74;;Other congenital malformations of limb;Q74 othe malformations congen members;;
Q75;;Other congenital malformations of skull and face bones;Q75 othe malformations congen skull and face bones;;
Q76;;Congenital malformations of the spine and chest bones;Q76 Malform congen spine bones chest;;
Q77;;Osteocondrodisplasia with growth anomalies of the long bones and spine;Q77 Osteocondr w / Anom cresc long bones col vert;;
Q78;;other osteochondrodysplasia;Q78 othe osteochondrodysplasia;;
Q79;;Congenital malformations of the musculoskeletal system, not elsewhere classified;Q79 malformations congen sist musculoskeletal NEC;;
Q80;;congenital ichthyosis;Q80 Ichthyosis congen;;
Q81;;Epidermolysis bullosa;Q81 epidermolysis bullosa;;
Q82;;Other congenital malformations of skin;Q82 othe malformations congen skin;;
Q83;;Congenital malformations of the breast;Q83 malformations breast congen;;
